{
  "schema_version": "execution_behavior_release_manifest_v3",
  "execution_behavior_release_id": "execution-behavior-release:812ef940d0c52688efb7b52a6222c69476f737d7de8433a1eace78e526d2552c",
  "execution_behavior_release_hash": "sha256:e95f29865f5f4bf417b341d3f775a41d40983c2fdc117a1cd110804c10ca285c",
  "private_prompt_commit": "2f267bc193e98f0c9ec63a4402a00b8afbcdf9ff",
  "private_prompt_bootstrap": {
    "schema_version": "private_prompt_parameter_bootstrap_release_v1",
    "release_hash": "sha256:53fd12fc87b7d3b09dfcdc67532bb1867e8830494bb98b05d771a3e956ba484e",
    "parameter_contract_hash": "sha256:59e2f34ff8832250c58cc93cdcd63a8523663b8bf6785bb3c4b6f7c56ef1bb3d",
    "behavior_contract_hash": "sha256:334b695174f34c7a671f8bfbe036ea2bfcbd4b06301e6736ec47a4008796d443",
    "state_tree_hash": "sha256:497d35745b6034b2b841f846c713689ecef5cea74d83dcaff934a025bce112b8",
    "prompt_tree_hash": "sha256:0d71c4f168a330414bd163bc16752f5eb7d3984a309a3c2d3b23faea5c3e7435",
    "state_count": 224
  },
  "provider_binding": {
    "provider": "anthropic",
    "model": "claude-sonnet-4",
    "base_url_mode": "PROVIDER_DEFAULT",
    "structured_output_mode": "JSON_SCHEMA_STRICT",
    "repair_policy": "BOUNDED_SCHEMA_REPAIR_V1"
  },
  "active_production_variants": [
    {
      "production_variant_roster_id": "production-variant-roster:c5486fae94a9ae1b2e1bd8db2239ed12b3cfc34678d7ce731b127e4290ce1c85",
      "cohort_id": "cohort_bull_2007",
      "language": "en"
    },
    {
      "production_variant_roster_id": "production-variant-roster:7690bbc7031d8798bc07e544f6088755c64f33366d7610276eee8d9747105406",
      "cohort_id": "cohort_bull_2007",
      "language": "zh"
    },
    {
      "production_variant_roster_id": "production-variant-roster:97bb9c980a4848cee1851fca759396566e96abe1691d49c8d9319098e754f254",
      "cohort_id": "cohort_bull_2016",
      "language": "en"
    },
    {
      "production_variant_roster_id": "production-variant-roster:6741738f7b56f4eab068d72bf5803efa589c034d090e94eda4819e44479b361c",
      "cohort_id": "cohort_bull_2016",
      "language": "zh"
    },
    {
      "production_variant_roster_id": "production-variant-roster:4e5061babe5355acfc29088e2bd9d679454ad909f13fd78b55016d1e9f6471c4",
      "cohort_id": "cohort_crisis_2008",
      "language": "en"
    },
    {
      "production_variant_roster_id": "production-variant-roster:8e997cba52c5313000c5987cb960a3d70f9d543ac71fbbe1f2fefdc3cfbdc740",
      "cohort_id": "cohort_crisis_2008",
      "language": "zh"
    },
    {
      "production_variant_roster_id": "production-variant-roster:80b73e57746f0274ebb401c94f35efa5a78ef216456315cd0761c010bce26b3d",
      "cohort_id": "cohort_crisis_covid",
      "language": "en"
    },
    {
      "production_variant_roster_id": "production-variant-roster:d2f160d544a27746ae4e535a70cec838e28edd5ce2b6b063dd0fe655ab63fff0",
      "cohort_id": "cohort_crisis_covid",
      "language": "zh"
    },
    {
      "production_variant_roster_id": "production-variant-roster:87e3d1da9cd27395ba29cf2d8bcbce35a881aaeb4ebf17dfee61cd28df269a73",
      "cohort_id": "cohort_default",
      "language": "en"
    },
    {
      "production_variant_roster_id": "production-variant-roster:1c434cef74c66651f6ce80e5da469f45c4d0cf0bbba0c6c53950016aaa789363",
      "cohort_id": "cohort_default",
      "language": "zh"
    },
    {
      "production_variant_roster_id": "production-variant-roster:def5bda99867a4f09549edb242e131b339d54c26ff2752cedfd33cbdc83e318e",
      "cohort_id": "cohort_euphoria_2021",
      "language": "en"
    },
    {
      "production_variant_roster_id": "production-variant-roster:62b6426ad4336ebc094a2cf2283762dfaf52e0608c2504a77e04a226f1e11b38",
      "cohort_id": "cohort_euphoria_2021",
      "language": "zh"
    },
    {
      "production_variant_roster_id": "production-variant-roster:42d2e8af548a2155c84a0fa546a9fd8421d15afece37c8e63f17d5f258beb752",
      "cohort_id": "cohort_rate_tightening",
      "language": "en"
    },
    {
      "production_variant_roster_id": "production-variant-roster:2164523fac5c04b618aca3cf8c4aed30ebee51caa59180a296bf52a83bf85e6b",
      "cohort_id": "cohort_rate_tightening",
      "language": "zh"
    },
    {
      "production_variant_roster_id": "production-variant-roster:3d5025c42fba22e4d884cf814b61120fc0c935f0b7823e5fa1f32fcc9c9ba145",
      "cohort_id": "cohort_recovery_2020",
      "language": "en"
    },
    {
      "production_variant_roster_id": "production-variant-roster:9ad0d755ee02696bb653610e3309d8979bb71cb07a78d781bd5f9563972eb086",
      "cohort_id": "cohort_recovery_2020",
      "language": "zh"
    }
  ],
  "execution_contracts": [
    {
      "execution_contract_id": "execution-contract:7643d48a6839729d9d909e803e62cf0581d6574a4c4e64333c98e1a1eb3e4bf7",
      "agent_id": "ackman",
      "language": "en",
      "immutable_contract_block_hash": "sha256:0a49a83d040c90c3701a2277d38a186b6b0bc95b54dc7cd25d81b2f7711c67e9",
      "execution_behavior_version": "execution-behavior:b2cce505b0e437b7f5449df90711d0f3182e5d0999423bccae994a39ce863922",
      "structured_output_schema_bindings": [
        {
          "phase": "DEFAULT",
          "schema_id": "superinvestor.ackman.output.v1",
          "schema_hash": "sha256:76c8babc344dbe8c90ac617e2de8a51fef93498657e03dc5a251905b25646d26",
          "immutable_phase_instruction_hash": "sha256:ab4e47dbe1cdaff755ae40caedb8af9f1726240fe4ef5aa01a6b52c606fa0541"
        }
      ],
      "structured_output_schema_set_hash": "sha256:479de0fda1bdda40f2f40e9ac8b8ccca7a42506ed0bd7a77366de5ce6bd4e90c",
      "structured_provider_contract_hash": "sha256:a2ae53e3f15fb04ec96bdd64b53ea821c58aedc8cd3f933aeaf3981005ca6c9f",
      "runtime_tool_manifest_hash": "sha256:7f233c26b2f93ab8c875b077fb5a56961516fbfca831bcf9c466b86d1a97a76e"
    },
    {
      "execution_contract_id": "execution-contract:7af69643958309e97a5a167f4fe108c8ca51bf5d4334bc2e1dc6f6c5226327cc",
      "agent_id": "ackman",
      "language": "zh",
      "immutable_contract_block_hash": "sha256:a258bd2327b02b341eae33035a61129273310b8dd7bebc7de328dd4cf6141625",
      "execution_behavior_version": "execution-behavior:d2e889f489dc79b4e92489eade5093fb0f350c37f9e4763c9a6506417f8aaba1",
      "structured_output_schema_bindings": [
        {
          "phase": "DEFAULT",
          "schema_id": "superinvestor.ackman.output.v1",
          "schema_hash": "sha256:76c8babc344dbe8c90ac617e2de8a51fef93498657e03dc5a251905b25646d26",
          "immutable_phase_instruction_hash": "sha256:802487bcd612ed327200636b8cf61d97e15133bc97e8ca47f9564a3a0eb7b9a4"
        }
      ],
      "structured_output_schema_set_hash": "sha256:98be0c7b7c1770ada73b7f582e7d8043a049f622b31a5dd5d2396b545bf013d1",
      "structured_provider_contract_hash": "sha256:a2ae53e3f15fb04ec96bdd64b53ea821c58aedc8cd3f933aeaf3981005ca6c9f",
      "runtime_tool_manifest_hash": "sha256:7f233c26b2f93ab8c875b077fb5a56961516fbfca831bcf9c466b86d1a97a76e"
    },
    {
      "execution_contract_id": "execution-contract:1be408d142d6d732bb1098f4805de7c1912829bb448c7fd1a550b3be0eec9eb1",
      "agent_id": "agriculture",
      "language": "en",
      "immutable_contract_block_hash": "sha256:3916dcd6ba7d7fb26f12ac2b065cabf8589852eaa73618a4be91c0408e0e4201",
      "execution_behavior_version": "execution-behavior:eac911ee76bf3d475059970d2793e4ddd90630332cddc823db7d7ee7a176cc4b",
      "structured_output_schema_bindings": [
        {
          "phase": "DIRECTION_RESEARCH",
          "schema_id": "agriculture.direction_research.v2",
          "schema_hash": "sha256:25ca6ff5f0779cf2906f7b149bb43227164c83e817ae8ebaa679b65edfc9d467",
          "immutable_phase_instruction_hash": "sha256:bdab5d83998b4533c9906b427f7d411c4d83951c12f0dff66a05e416148a7f11"
        },
        {
          "phase": "CONFLICT_REVIEW",
          "schema_id": "agriculture.conflict_review.v2",
          "schema_hash": "sha256:47df0c703afe52f39eb1e681354df276477d1062e432b89b305dc0bf7c511d40",
          "immutable_phase_instruction_hash": "sha256:3cc68a5a19d24f0ccb7c7715ef8e93cd9e60f4e321945e5b18f17a334a6b5389"
        },
        {
          "phase": "FINAL_SELECTION",
          "schema_id": "agriculture.final_selection.v2",
          "schema_hash": "sha256:41719b53a28f39d01e8bdfcf101d6cedfe6d50010804dd57efb2a4f05e81129e",
          "immutable_phase_instruction_hash": "sha256:8d011368fef614310397b813673af8ef052587d7e3ac1b792b7d78406cfe00da"
        }
      ],
      "structured_output_schema_set_hash": "sha256:5be8f1311fd37be54cdd738d8547df10e73809a479c06c3cc4a67d06b5b839d4",
      "structured_provider_contract_hash": "sha256:1334579f1c8b73c44e908557581322f2a7d09cb9b7b3d11c9a8f3b7098faf917",
      "runtime_tool_manifest_hash": "sha256:4a039ca6d07088e156ab63eee25ab4df86af31622bfe492b97f36c5cb596e80a"
    },
    {
      "execution_contract_id": "execution-contract:da79639bf4fafa21a97bc66d2348ed523aed47c99dde862b0c661890c1fda292",
      "agent_id": "agriculture",
      "language": "zh",
      "immutable_contract_block_hash": "sha256:7dc01ac056ad90c72c38f1f925ab44f5e2a1b7dd1eaf76a8534a6c214d3fbb14",
      "execution_behavior_version": "execution-behavior:4b3b278721459f5fa40e8eb1e3eeb8a0a24f20ac750718df4f6478c0bc6cdd69",
      "structured_output_schema_bindings": [
        {
          "phase": "DIRECTION_RESEARCH",
          "schema_id": "agriculture.direction_research.v2",
          "schema_hash": "sha256:25ca6ff5f0779cf2906f7b149bb43227164c83e817ae8ebaa679b65edfc9d467",
          "immutable_phase_instruction_hash": "sha256:a194e59e47ecdb5f15df94fc66887c868621783139bbc3e0c4203c2b4ae29153"
        },
        {
          "phase": "CONFLICT_REVIEW",
          "schema_id": "agriculture.conflict_review.v2",
          "schema_hash": "sha256:47df0c703afe52f39eb1e681354df276477d1062e432b89b305dc0bf7c511d40",
          "immutable_phase_instruction_hash": "sha256:6170855b61a59c911dcbd3989d2cf7c41726d12b90b00f8cca1339c5727d064a"
        },
        {
          "phase": "FINAL_SELECTION",